{
  "$schema": "http://json-schema.org/draft-07/schema#",
  "title": "Exceptions for abandoned packages",
  "description": "Community-sourced overrides for packages that appear abandoned but are still maintained",
  "type": "object",
  "definitions": {
    "datasourceConfig": {
      "type": "object",
      "additionalProperties": {
        "type": "string"
      }
    }
  },
  "properties": {
    "$schema": { "type": "string" },
    "artifactory": { "$ref": "#/definitions/datasourceConfig" },
    "aws-eks-addon": { "$ref": "#/definitions/datasourceConfig" },
    "aws-machine-image": { "$ref": "#/definitions/datasourceConfig" },
    "aws-rds": { "$ref": "#/definitions/datasourceConfig" },
    "azure-bicep-resource": { "$ref": "#/definitions/datasourceConfig" },
    "azure-pipelines-tasks": { "$ref": "#/definitions/datasourceConfig" },
    "bazel": { "$ref": "#/definitions/datasourceConfig" },
    "bitbucket-server-tags": { "$ref": "#/definitions/datasourceConfig" },
    "bitbucket-tags": { "$ref": "#/definitions/datasourceConfig" },
    "bitrise": { "$ref": "#/definitions/datasourceConfig" },
    "buildpacks-registry": { "$ref": "#/definitions/datasourceConfig" },
    "cdnjs": { "$ref": "#/definitions/datasourceConfig" },
    "clojure": { "$ref": "#/definitions/datasourceConfig" },
    "conan": { "$ref": "#/definitions/datasourceConfig" },
    "conda": { "$ref": "#/definitions/datasourceConfig" },
    "cpan": { "$ref": "#/definitions/datasourceConfig" },
    "crate": { "$ref": "#/definitions/datasourceConfig" },
    "custom": { "$ref": "#/definitions/datasourceConfig" },
    "dart": { "$ref": "#/definitions/datasourceConfig" },
    "dart-version": { "$ref": "#/definitions/datasourceConfig" },
    "deb": { "$ref": "#/definitions/datasourceConfig" },
    "deno": { "$ref": "#/definitions/datasourceConfig" },
    "devbox": { "$ref": "#/definitions/datasourceConfig" },
    "docker": { "$ref": "#/definitions/datasourceConfig" },
    "dotnet-version": { "$ref": "#/definitions/datasourceConfig" },
    "endoflife-date": { "$ref": "#/definitions/datasourceConfig" },
    "flutter-version": { "$ref": "#/definitions/datasourceConfig" },
    "galaxy": { "$ref": "#/definitions/datasourceConfig" },
    "galaxy-collection": { "$ref": "#/definitions/datasourceConfig" },
    "git-refs": { "$ref": "#/definitions/datasourceConfig" },
    "git-tags": { "$ref": "#/definitions/datasourceConfig" },
    "gitea-releases": { "$ref": "#/definitions/datasourceConfig" },
    "gitea-tags": { "$ref": "#/definitions/datasourceConfig" },
    "github-release-attachments": { "$ref": "#/definitions/datasourceConfig" },
    "github-releases": { "$ref": "#/definitions/datasourceConfig" },
    "github-runners": { "$ref": "#/definitions/datasourceConfig" },
    "github-tags": { "$ref": "#/definitions/datasourceConfig" },
    "gitlab-packages": { "$ref": "#/definitions/datasourceConfig" },
    "gitlab-releases": { "$ref": "#/definitions/datasourceConfig" },
    "gitlab-tags": { "$ref": "#/definitions/datasourceConfig" },
    "glasskube-packages": { "$ref": "#/definitions/datasourceConfig" },
    "go": { "$ref": "#/definitions/datasourceConfig" },
    "go-direct": { "$ref": "#/definitions/datasourceConfig" },
    "go-proxy": { "$ref": "#/definitions/datasourceConfig" },
    "golang-version": { "$ref": "#/definitions/datasourceConfig" },
    "gradle-version": { "$ref": "#/definitions/datasourceConfig" },
    "hackage": { "$ref": "#/definitions/datasourceConfig" },
    "helm": { "$ref": "#/definitions/datasourceConfig" },
    "hermit": { "$ref": "#/definitions/datasourceConfig" },
    "hex": { "$ref": "#/definitions/datasourceConfig" },
    "hexpm-bob": { "$ref": "#/definitions/datasourceConfig" },
    "java-version": { "$ref": "#/definitions/datasourceConfig" },
    "jenkins-plugins": { "$ref": "#/definitions/datasourceConfig" },
    "kubernetes-api": { "$ref": "#/definitions/datasourceConfig" },
    "maven": { "$ref": "#/definitions/datasourceConfig" },
    "node-version": { "$ref": "#/definitions/datasourceConfig" },
    "npm": { "$ref": "#/definitions/datasourceConfig" },
    "nuget": { "$ref": "#/definitions/datasourceConfig" },
    "orb": { "$ref": "#/definitions/datasourceConfig" },
    "packagist": { "$ref": "#/definitions/datasourceConfig" },
    "pod": { "$ref": "#/definitions/datasourceConfig" },
    "puppet-forge": { "$ref": "#/definitions/datasourceConfig" },
    "pypi": { "$ref": "#/definitions/datasourceConfig" },
    "python-version": { "$ref": "#/definitions/datasourceConfig" },
    "repology": { "$ref": "#/definitions/datasourceConfig" },
    "ruby-version": { "$ref": "#/definitions/datasourceConfig" },
    "rubygems": { "$ref": "#/definitions/datasourceConfig" },
    "sbt-package": { "$ref": "#/definitions/datasourceConfig" },
    "sbt-plugin": { "$ref": "#/definitions/datasourceConfig" },
    "terraform-module": { "$ref": "#/definitions/datasourceConfig" },
    "terraform-provider": { "$ref": "#/definitions/datasourceConfig" },
    "unity3d": { "$ref": "#/definitions/datasourceConfig" }
  },
  "additionalProperties": {
    "$ref": "#/definitions/datasourceConfig"
  }
}
